{
  "contractVersion": 4,
  "manager": {
    "schemaVersion": 4,
    "name": "opencode-ship",
    "version": "1.1.7",
    "templateSet": "v1.1.7",
    "profile": "engineering",
    "appliedAt": "2026-09-01T16:10:13.919Z",
    "setupComplete": true,
    "config": {
      "path": ".opencode/ship.config.json",
      "sha256": "c996207843bd609682da804b7b5b7ad0014b69d9b2142f3ae04d4c7089ef472a",
      "existed": false
    },
    "rootDocuments": [
      {
        "path": "opencode.json",
        "format": "json",
        "pointers": [
          {
            "pointer": "/subagent_depth",
            "strategy": "value",
            "scope": "engineering",
            "installedSha256": "d4735e3a265e16eee03f59718b9b5d03019c07d8b6c51f90da3a666eec13ab35",
            "previous": {
              "existed": false
            }
          },
          {
            "pointer": "/agent/build/permission/task/*",
            "strategy": "value",
            "scope": "engineering",
            "installedSha256": "d2a00b488ac374247aa72cf83ed3a7637985deb3f6f282a4c420af0cc45c5277",
            "previous": {
              "existed": false
            }
          },
          {
            "pointer": "/agent/build/permission/task/ship-controller",
            "strategy": "value",
            "scope": "engineering",
            "installedSha256": "58d46b625a55ee18af5cfc1b8f4c237f3523a9ac5184cfe64460c6e17810828a",
            "previous": {
              "existed": false
            }
          },
          {
            "pointer": "/agent/build/permission/task/general",
            "strategy": "value",
            "scope": "engineering",
            "installedSha256": "58d46b625a55ee18af5cfc1b8f4c237f3523a9ac5184cfe64460c6e17810828a",
            "previous": {
              "existed": false
            }
          },
          {
            "pointer": "/agent/build/permission/task/plan",
            "strategy": "value",
            "scope": "engineering",
            "installedSha256": "d2a00b488ac374247aa72cf83ed3a7637985deb3f6f282a4c420af0cc45c5277",
            "previous": {
              "existed": false
            }
          },
          {
            "pointer": "/agent/build/permission/task/delivery-reviewer",
            "strategy": "value",
            "scope": "engineering",
            "installedSha256": "58d46b625a55ee18af5cfc1b8f4c237f3523a9ac5184cfe64460c6e17810828a",
            "previous": {
              "existed": false
            }
          },
          {
            "pointer": "/agent/build/permission/task/delivery-verifier",
            "strategy": "value",
            "scope": "engineering",
            "installedSha256": "58d46b625a55ee18af5cfc1b8f4c237f3523a9ac5184cfe64460c6e17810828a",
            "previous": {
              "existed": false
            }
          },
          {
            "pointer": "/agent/build/permission/bash/git --hard *",
            "strategy": "value",
            "scope": "engineering",
            "installedSha256": "d2a00b488ac374247aa72cf83ed3a7637985deb3f6f282a4c420af0cc45c5277",
            "previous": {
              "existed": false
            }
          },
          {
            "pointer": "/agent/build/permission/bash/git --force *",
            "strategy": "value",
            "scope": "engineering",
            "installedSha256": "d2a00b488ac374247aa72cf83ed3a7637985deb3f6f282a4c420af0cc45c5277",
            "previous": {
              "existed": false
            }
          },
          {
            "pointer": "/agent/build/permission/bash/git -f *",
            "strategy": "value",
            "scope": "engineering",
            "installedSha256": "d2a00b488ac374247aa72cf83ed3a7637985deb3f6f282a4c420af0cc45c5277",
            "previous": {
              "existed": false
            }
          },
          {
            "pointer": "/agent/build/permission/bash/git clean -fd *",
            "strategy": "value",
            "scope": "engineering",
            "installedSha256": "d2a00b488ac374247aa72cf83ed3a7637985deb3f6f282a4c420af0cc45c5277",
            "previous": {
              "existed": false
            }
          },
          {
            "pointer": "/agent/build/permission/bash/git stash *",
            "strategy": "value",
            "scope": "engineering",
            "installedSha256": "d2a00b488ac374247aa72cf83ed3a7637985deb3f6f282a4c420af0cc45c5277",
            "previous": {
              "existed": false
            }
          },
          {
            "pointer": "/agent/build/permission/bash/git worktree remove --force *",
            "strategy": "value",
            "scope": "engineering",
            "installedSha256": "d2a00b488ac374247aa72cf83ed3a7637985deb3f6f282a4c420af0cc45c5277",
            "previous": {
              "existed": false
            }
          },
          {
            "pointer": "/agent/build/permission/bash/git branch -D *",
            "strategy": "value",
            "scope": "engineering",
            "installedSha256": "d2a00b488ac374247aa72cf83ed3a7637985deb3f6f282a4c420af0cc45c5277",
            "previous": {
              "existed": false
            }
          },
          {
            "pointer": "/agent/build/permission/bash/rm *",
            "strategy": "value",
            "scope": "engineering",
            "installedSha256": "e43a5493c180fde1ca0c3b266b7781876016f68d2caaa937e049f3c050b87a66",
            "previous": {
              "existed": false
            }
          },
          {
            "pointer": "/agent/build/permission/delivery_cleanup",
            "strategy": "value",
            "scope": "engineering",
            "installedSha256": "58d46b625a55ee18af5cfc1b8f4c237f3523a9ac5184cfe64460c6e17810828a",
            "previous": {
              "existed": false
            }
          },
          {
            "pointer": "/agent/build/permission/delivery_github_read",
            "strategy": "value",
            "scope": "engineering",
            "installedSha256": "d2a00b488ac374247aa72cf83ed3a7637985deb3f6f282a4c420af0cc45c5277",
            "previous": {
              "existed": false
            }
          },
          {
            "pointer": "/agent/build/permission/delivery_inspect",
            "strategy": "value",
            "scope": "engineering",
            "installedSha256": "58d46b625a55ee18af5cfc1b8f4c237f3523a9ac5184cfe64460c6e17810828a",
            "previous": {
              "existed": false
            }
          },
          {
            "pointer": "/agent/build/permission/delivery_issue",
            "strategy": "value",
            "scope": "engineering",
            "installedSha256": "58d46b625a55ee18af5cfc1b8f4c237f3523a9ac5184cfe64460c6e17810828a",
            "previous": {
              "existed": false
            }
          },
          {
            "pointer": "/agent/build/permission/delivery_issue_close",
            "strategy": "value",
            "scope": "engineering",
            "installedSha256": "e43a5493c180fde1ca0c3b266b7781876016f68d2caaa937e049f3c050b87a66",
            "previous": {
              "existed": false
            }
          },
          {
            "pointer": "/agent/build/permission/delivery_issue_comment",
            "strategy": "value",
            "scope": "engineering",
            "installedSha256": "d2a00b488ac374247aa72cf83ed3a7637985deb3f6f282a4c420af0cc45c5277",
            "previous": {
              "existed": false
            }
          },
          {
            "pointer": "/agent/build/permission/delivery_issue_labels",
            "strategy": "value",
            "scope": "engineering",
            "installedSha256": "d2a00b488ac374247aa72cf83ed3a7637985deb3f6f282a4c420af0cc45c5277",
            "previous": {
              "existed": false
            }
          },
          {
            "pointer": "/agent/build/permission/delivery_issue_link",
            "strategy": "value",
            "scope": "engineering",
            "installedSha256": "d2a00b488ac374247aa72cf83ed3a7637985deb3f6f282a4c420af0cc45c5277",
            "previous": {
              "existed": false
            }
          },
          {
            "pointer": "/agent/build/permission/delivery_merge",
            "strategy": "value",
            "scope": "engineering",
            "installedSha256": "e43a5493c180fde1ca0c3b266b7781876016f68d2caaa937e049f3c050b87a66",
            "previous": {
              "existed": false
            }
          },
          {
            "pointer": "/agent/build/permission/delivery_pr",
            "strategy": "value",
            "scope": "engineering",
            "installedSha256": "58d46b625a55ee18af5cfc1b8f4c237f3523a9ac5184cfe64460c6e17810828a",
            "previous": {
              "existed": false
            }
          },
          {
            "pointer": "/agent/build/permission/delivery_publish",
            "strategy": "value",
            "scope": "engineering",
            "installedSha256": "d2a00b488ac374247aa72cf83ed3a7637985deb3f6f282a4c420af0cc45c5277",
            "previous": {
              "existed": false
            }
          },
          {
            "pointer": "/agent/build/permission/delivery_ready",
            "strategy": "value",
            "scope": "engineering",
            "installedSha256": "58d46b625a55ee18af5cfc1b8f4c237f3523a9ac5184cfe64460c6e17810828a",
            "previous": {
              "existed": false
            }
          },
          {
            "pointer": "/agent/build/permission/delivery_review",
            "strategy": "value",
            "scope": "engineering",
            "installedSha256": "d2a00b488ac374247aa72cf83ed3a7637985deb3f6f282a4c420af0cc45c5277",
            "previous": {
              "existed": false
            }
          },
          {
            "pointer": "/agent/build/permission/delivery_sync",
            "strategy": "value",
            "scope": "engineering",